job_type,job_title,search_volume,competition_level,url_slug,seo_title,meta_description
sales,Sales Associate,high,high,sales-associate-jobs,Sales Associate Jobs | AI-Powered Hiring | Applicants.io,Find Sales Associate jobs with AI-powered matching. Applicants.io showcases your strengths to get you hired fast. Apply today.
customer-service,Customer Service Representative,high,high,customer-service-representative-jobs,Customer Service Jobs | Remote & Local | Applicants.io,Apply for Customer Service Representative jobs. AI-powered platform matches you with employers who value your skills. Start your application now.
IT,Software Developer,high,high,software-developer-jobs,Software Developer Jobs | AI-Matched Opportunities | Applicants.io,Discover Software Developer positions with AI-powered job matching. Showcase your coding skills to top employers. Apply today.
healthcare,Registered Nurse,high,high,registered-nurse-jobs,Registered Nurse Jobs | Healthcare Careers | Applicants.io,Find Registered Nurse positions with AI-powered matching. Applicants.io helps nurses connect with healthcare employers. Apply now.
retail,Retail Sales Associate,high,medium,retail-sales-associate-jobs,Retail Sales Jobs | Flexible Hours | Applicants.io,Explore Retail Sales Associate opportunities with AI-powered job matching. Flexible schedules available. Apply today.
admin,Administrative Assistant,high,medium,administrative-assistant-jobs,Admin Assistant Jobs | Office Support Roles | Applicants.io,Find Administrative Assistant positions with AI-powered matching. Office support roles with growth opportunities. Apply now.
drivers,Delivery Driver,high,medium,delivery-driver-jobs,Delivery Driver Jobs | Flexible Schedule | Applicants.io,Apply for Delivery Driver positions with flexible schedules. AI-powered matching connects you with local employers. Start today.
healthcare,Medical Assistant,high,medium,medical-assistant-jobs,Medical Assistant Jobs | Healthcare Support | Applicants.io,Discover Medical Assistant careers with AI-powered job matching. Healthcare support roles with training opportunities. Apply now.
IT,IT Support Specialist,high,medium,it-support-specialist-jobs,IT Support Jobs | Tech Careers | Applicants.io,Find IT Support Specialist positions with AI-powered matching. Tech careers with growth potential. Apply today.
sales,Sales Manager,high,high,sales-manager-jobs,Sales Manager Jobs | Leadership Roles | Applicants.io,Apply for Sales Manager positions with AI-powered matching. Leadership opportunities with competitive packages. Apply now.
internship,Marketing Intern,low,low,marketing-internship-jobs,Marketing Intern Jobs | Entry-Level Experience | Applicants.io,Start your marketing career with Marketing Intern positions. AI-powered matching for entry-level opportunities. Apply today.
entry-level,Data Entry Clerk,medium,low,data-entry-clerk-jobs,Data Entry Jobs | Remote & Office | Applicants.io,Find Data Entry Clerk positions with flexible work options. AI-powered matching for entry-level candidates. Apply now.
bilingual,Customer Service Rep - Bilingual,medium,low,bilingual-customer-service-jobs,Bilingual Customer Service Jobs | Spanish/English | Applicants.io,Apply for Bilingual Customer Service positions. Spanish/English speakers needed. AI-powered matching connects you with employers. Apply today.
seasonal,Seasonal Retail Associate,medium,low,seasonal-retail-jobs,Seasonal Retail Jobs | Holiday & Summer | Applicants.io,Find Seasonal Retail Associate positions for holidays and summer. Flexible temporary work with AI-powered matching. Apply today.
trades,Maintenance Technician,medium,low,maintenance-technician-jobs,Maintenance Tech Jobs | Skilled Trades | Applicants.io,Discover Maintenance Technician positions with competitive pay. Skilled trades opportunities with AI-powered matching. Apply now.
remote,Virtual Assistant,medium,low,virtual-assistant-jobs,Remote Virtual Assistant Jobs | Work from Home | Applicants.io,Apply for Virtual Assistant positions and work from home. AI-powered matching for remote opportunities. Start today.
entry-level,Receptionist,medium,low,receptionist-jobs,Receptionist Jobs | Front Desk Positions | Applicants.io,Find Receptionist positions with AI-powered matching. Front desk roles with customer service opportunities. Apply now.
local,Local Restaurant Server,low,low,restaurant-server-jobs,Restaurant Server Jobs | Local Dining | Applicants.io,Apply for Local Restaurant Server positions. Part-time and full-time opportunities with tips. AI-powered matching available. Apply today.
trades,Plumber Assistant,low,low,plumber-assistant-jobs,Plumber Assistant Jobs | Trade Apprenticeship | Applicants.io,Start your plumbing career with Plumber Assistant positions. Trade apprenticeship opportunities with AI-powered matching. Apply today.
remote,Online Chat Support,low,low,online-chat-support-jobs,Online Chat Support Jobs | Remote Work | Applicants.io,Work from home as Online Chat Support representative. AI-powered matching for remote customer service roles. Apply today.
